{
  "schemaVersion": 1,
  "id": "default",
  "name": "默认（纸墨风）",
  "version": "1.0.0",
  "description": "内置默认高亮方案：突出标题、占位符、对话引号、动作括号、强调符号与档案字段，弱化装饰性符号，适合长时间纯文本编辑。",
  "extends": null,
  "editor": {
    "fontFamily": "Sarasa Mono SC, Consolas, Menlo, monospace",
    "fontSize": 14,
    "lineHeight": 1.75,
    "tabSize": 2
  },
  "theme": {
    "foreground": "#2b2b2b",
    "background": "#fbf9f4",
    "caret": "#b45309",
    "selectionBackground": "#f2e3c6"
  },
  "scopes": [
    { "id": "heading", "label": "板块/小节标题", "color": "#1f4e79", "bold": true },
    { "id": "subheading", "label": "小标题", "color": "#2e6b4f", "bold": true },
    { "id": "placeholder", "label": "占位符（{{char}}/{{user}}）", "color": "#b0341b", "backgroundColor": "#fdece7", "bold": true },
    { "id": "placeholder-custom", "label": "其他宏/占位符", "color": "#8a5a00", "backgroundColor": "#fdf3e0" },
    { "id": "dialogue", "label": "对话引号内容", "color": "#0f6b6b" },
    { "id": "action", "label": "动作/旁白括号", "color": "#6b4c9a", "italic": true },
    { "id": "emphasis", "label": "强调（**...**）", "color": "#a3246b", "bold": true },
    { "id": "attribute", "label": "档案字段名", "color": "#7a4b16", "bold": true },
    { "id": "list", "label": "列表项", "color": "#3c5a99" },
    { "id": "separator", "label": "分隔线", "color": "#b9b1a3" },
    { "id": "comment", "label": "注释/括注", "color": "#8b8b8b", "italic": true }
  ],
  "rules": [
    {
      "id": "block-heading",
      "scope": "heading",
      "priority": 100,
      "match": { "type": "regex", "pattern": "^【[^】\\n]{1,30}】\\s*$", "flags": "gm", "wholeLine": true }
    },
    {
      "id": "markdown-heading",
      "scope": "heading",
      "priority": 100,
      "match": { "type": "regex", "pattern": "^#{1,6}\\s+.*$", "flags": "gm", "wholeLine": true }
    },
    {
      "id": "bracket-heading",
      "scope": "heading",
      "priority": 95,
      "match": { "type": "regex", "pattern": "^\\[[^\\]\\n]{1,30}\\]\\s*$", "flags": "gm", "wholeLine": true }
    },
    {
      "id": "char-placeholder",
      "scope": "placeholder",
      "priority": 90,
      "match": { "type": "delimiter-block", "open": "{{", "close": "}}" }
    },
    {
      "id": "custom-macro",
      "scope": "placeholder-custom",
      "priority": 60,
      "match": { "type": "regex", "pattern": "<[A-Za-z_][A-Za-z0-9_]{0,20}>", "flags": "g" }
    },
    {
      "id": "dialogue-double-quote",
      "scope": "dialogue",
      "priority": 50,
      "match": { "type": "regex", "pattern": "\"[^\"\\n]{1,400}\"", "flags": "g" }
    },
    {
      "id": "dialogue-cn-quote",
      "scope": "dialogue",
      "priority": 50,
      "match": { "type": "regex", "pattern": "[「『][^」』\\n]{1,400}[」』]", "flags": "g" }
    },
    {
      "id": "action-cn-paren",
      "scope": "action",
      "priority": 40,
      "match": { "type": "regex", "pattern": "（[^）\\n]{1,400}）", "flags": "g" }
    },
    {
      "id": "action-ascii-paren",
      "scope": "action",
      "priority": 40,
      "match": { "type": "regex", "pattern": "\\([^)\\n]{1,400}\\)", "flags": "g" }
    },
    {
      "id": "bold-emphasis",
      "scope": "emphasis",
      "priority": 70,
      "match": { "type": "regex", "pattern": "\\*\\*[^*\\n]{1,200}\\*\\*", "flags": "g" }
    },
    {
      "id": "profile-attribute",
      "scope": "attribute",
      "priority": 30,
      "match": {
        "type": "word-list",
        "words": ["身高", "体重", "年龄", "生日", "身份", "性别", "外貌", "穿搭", "发色", "瞳色", "职业", "称呼", "关系"],
        "caseSensitive": false,
        "wholeWord": false
      }
    },
    {
      "id": "list-item",
      "scope": "list",
      "priority": 20,
      "match": { "type": "regex", "pattern": "^\\s*(?:[-*+·]|\\d+[.、)])\\s+", "flags": "gm" }
    },
    {
      "id": "hr-line",
      "scope": "separator",
      "priority": 80,
      "match": { "type": "regex", "pattern": "^\\s*(?:[-=_*]\\s*){3,}$", "flags": "gm", "wholeLine": true }
    },
    {
      "id": "commented-note",
      "scope": "comment",
      "priority": 10,
      "match": { "type": "regex", "pattern": "^//.*$", "flags": "gm", "wholeLine": true }
    },

    {
      "id": "worldbook-entry-open",
      "scope": "heading",
      "priority": 100,
      "appliesTo": ["block:worldbook"],
      "match": { "type": "regex", "pattern": "^@@ENTRY\\s+\\d+\\s*$", "flags": "gm", "wholeLine": true }
    },
    {
      "id": "worldbook-content-mark",
      "scope": "subheading",
      "priority": 98,
      "appliesTo": ["block:worldbook"],
      "match": { "type": "regex", "pattern": "^@@CONTENT\\s*$", "flags": "gm", "wholeLine": true }
    },
    {
      "id": "worldbook-entry-close",
      "scope": "separator",
      "priority": 96,
      "appliesTo": ["block:worldbook"],
      "match": { "type": "regex", "pattern": "^@@END\\s+\\d+\\s*$", "flags": "gm", "wholeLine": true }
    },
    {
      "id": "worldbook-trigger-keys",
      "scope": "attribute",
      "priority": 88,
      "appliesTo": ["block:worldbook"],
      "match": { "type": "regex", "pattern": "^keys\\s*:.*$", "flags": "gm", "wholeLine": true }
    },
    {
      "id": "worldbook-entry-name",
      "scope": "subheading",
      "priority": 86,
      "appliesTo": ["block:worldbook"],
      "match": { "type": "regex", "pattern": "^name\\s*:.*$", "flags": "gm", "wholeLine": true }
    },

    {
      "id": "example-start-marker",
      "scope": "subheading",
      "priority": 94,
      "appliesTo": ["block:chat-examples"],
      "match": { "type": "regex", "pattern": "^<START>\\s*$", "flags": "gm", "wholeLine": true }
    },
    {
      "id": "scene-divider",
      "scope": "separator",
      "priority": 78,
      "appliesTo": ["block:initial-scene"],
      "match": { "type": "regex", "pattern": "^\\s*(?:-{3,}|={3,}|\\*{3,}|~{3,})\\s*$", "flags": "gm", "wholeLine": true }
    }
  ],
  "metadata": {
    "author": "Tavern Card Studio",
    "license": "MIT",
    "updatedAt": "2026-10-21"
  }
}
